{
  "$schema": "../../docs/rail-manifest.schema.json",
  "id": "co-worker",
  "label": "Co-Worker",
  "description": "Turns a pile of harvested email, calendar invites and chat messages into one prioritized executive brief, so a morning of triage becomes a page you can read in two minutes.",
  "icon": "🧭",
  "package": "co_worker_app",
  "federation_name": "co_worker",
  "css_wrapper": "co-worker",
  "layout": "backend",
  "env_prefix": "CO_WORKER_",
  "ports": {
    "backend": 8890,
    "dev": 5310
  },
  "status_route": "/api/models",
  "model_slots": [
    {
      "slot": "synthesis",
      "label": "Synthesis",
      "env": "CO_WORKER_SYNTHESIS_MODEL",
      "role": "co-worker-synthesis",
      "kind": "chat",
      "admin_panel": true
    }
  ],
  "notes": [
    "No embedder slot on purpose: the brief is synthesised from whole items, not retrieved chunks, so there is nothing to embed.",
    "The only rail with no database and no corpus. Its input is a directory of JSON files written by an external harvest process on the Windows host and bind-mounted in; the contract for those files is SCHEMA.md, which is a separate contract from this manifest.",
    "CO_WORKER_PROMPTS_DIR and the read-only /data/prompts mount are wired ahead of the API that will serve them. Deliberate groundwork, not dead config."
  ]
}
